{
  "version": "1",
  "id": "AUniqId?",
  "requesterInfo": {
    "app": {
      "description": "NA",
      "id": "pNCIYblwy",
      "name": "Thundercats",
      "logo": "https://s3.amazonaws.com/dev-integration-portal-app-logos/kx3VTykbN/1548405721-thundercats.jpeg",
      "primaryColor": "#A80B00",
      "secondaryColor": "#000000"
    },
    "requesterId": "3735a5b4-8a1f-11e8-9a94-a6cf71072f73"
  },
  "timestamp": "2019-08-01T19:16:39.336Z",
  "authentication": true,
  "credentialItems": [
    {
      "identifier": "credential-cvc:IdDocument-v2",
      "constraints": {
        "meta": {
          "credential": "credential-cvc:IdDocument-v2",
          "issuer": {
            "is": {
              "$eq": "did:ethr:0x1a88a35421a4a0d3e13fe4e8ebcf18e9a249dc5a"
            }
          }
        }
      }
    }
  ],
  "channels": {
    "evidences": {
      "idDocumentFront": {
        "accepts": "application/json",
        "method": "put",
        "url": "https://put-url.com"
      },
      "idDocumentBack": {
        "accepts": "application/json",
        "method": "put",
        "url": "https://put-url.com"
      },
      "selfie": {
        "accepts": "application/json",
        "method": "put",
        "url": "https://put-url.com"
      }
    },
    "eventsURL": "https://awesome-idr.com/response/events",
    "payloadURL": "https://awesome-idr.com/response/payload"
  }
}
