{
  "id": "AUniqId?",
  "version": "1",
  "requesterInfo": {
    "requesterId": "uuid",
    "app": {
      "id": "uuid",
      "name": "App Name",
      "logo": "https://server/path/logo.png",
      "description": "App Description",
      "primaryColor": "2345EE",
      "secondaryColor": "2345FF"
    }
  },
  "timestamp": "2018-07-04T00:11:55.698Z",
  "authentication": true,
  "channels": {
    "eventsURL": "https://server/events/UUID",
    "payloadURL": "https://server/payload/UUID"
  },
  "credentialItems": [
    {"identifier": "GlobalIdentifier1"},
    {"identifier": "GlobalIdentifier2"},
    {"identifier": "GlobalIdentifier3"}
  ]
}
